{"$schema":"https://artemsemdev.github.io/SeaRise-Europe/contracts/release/v2/attribution.schema.json","dataProvenanceClass":"synthetic-fixture","dataReleaseId":"searise-europe-v1.0.0-20260810-c096aeab4e09","records":[{"appliesToRoles":["projection-analysis-cog","projection-geoparquet","projection-visual-pmtiles","range-integrity-index","source-grid-identity"],"attributionId":"ipcc-ar6-sl-projections-20210809","attributionText":"Garner et al. (2021), IPCC AR6 Sea Level Projections, version 20210809, doi:10.5281/zenodo.5914709.","licence":{"name":"Creative Commons Attribution 4.0 International","spdxId":"CC-BY-4.0","url":"https://creativecommons.org/licenses/by/4.0/"},"redistribution":"allowed","sourceId":"ipcc-ar6-sea-level/20210809","sourceSha256":"d3b1c2ed093cca491db2461e67b782bcca98763d326378ffee39908c2b094e91","sourceUrl":"https://doi.org/10.5281/zenodo.6382554","title":"IPCC AR6 Sea Level Projections"},{"appliesToRoles":["architecture-evidence","build-receipt","checksums","methodology","provenance","quality-summary","sbom","scenario-config","settlement-geoparquet","settlement-search-index","signature","source-attribution","source-receipt","stac-catalog","stac-collection","stac-item"],"attributionId":"geonames-fixture","attributionText":"Synthetic fixture metadata and settlement record; not approved scientific output.","licence":{"name":"Creative Commons Attribution 4.0 International","spdxId":"CC-BY-4.0","url":"https://creativecommons.org/licenses/by/4.0/"},"redistribution":"allowed","sourceId":"fixture/public-release-metadata","sourceSha256":"cdb76a7956b5e627bbb2cfb18a4369ed955b703817ba87b58afa11240357ccee","sourceUrl":"https://fixtures.searise.invalid/public-release/v1","title":"SeaRise Europe committed public release fixture metadata"},{"attributionId":"natural-earth-boundaries","sourceId":"natural-earth-10m/5.1.1","title":"Natural Earth 1:10m physical and cultural vectors","sourceUrl":"https://www.naturalearthdata.com/","sourceSha256":"2623fc05db56e8f67de95b555b7a5e43f54012f824fbf3154d04283313b7a6e8","attributionText":"Made with Natural Earth.","licence":{"spdxId":"LicenseRef-Natural-Earth-Public-Domain","name":"Natural Earth public domain dedication","url":"https://www.naturalearthdata.com/about/terms-of-use/"},"redistribution":"allowed","appliesToRoles":["support-boundary","coastal-boundary"]},{"attributionId":"browser-nodata-control-fixture","sourceId":"searise-browser-nodata-control/v1","title":"SeaRise Europe browser-only ADR-024 nodata control","sourceUrl":"https://github.com/artemsemdev/SeaRise-Europe","sourceSha256":"55a3811d7c56879b5ac5cff6e0a868cd22a8a545305ddb718a9697244c431d2e","attributionText":"Synthetic browser-only DataUnavailable control; not production or public scientific evidence.","licence":{"spdxId":"CC-BY-4.0","name":"Creative Commons Attribution 4.0 International","url":"https://creativecommons.org/licenses/by/4.0/"},"redistribution":"allowed","appliesToRoles":["support-boundary","coastal-boundary"]}],"schemaVersion":"2.0.0"}
